ID,SEG/SUB,NOME
PROD_1,0001/0001,CARTAO BANESTES VISA GOLD
PROD_2,0001/0003,CARTAO BANESTES VISA INTERNAT BANESPHONE
PROD_3,0001/0005,CARTAO BANESTES VISA INTERNAT REDE PLUS
PROD_4,0001/0004,CARTAO BANESTES VISA INTERNAT- CENTRAL DE ATEND 24 HS
PROD_5,0001/0002,CARTAO BANESTES VISA INTERNACIONAL
PROD_6,0001/0006,CARTAO BANESTES VISA GOLD-ADICIONAL MULTIPLO
PROD_7,0001/0007,CARTAO BANESTES VISA GOLD-ADICIONAL
PROD_8,0001/0008,CARTAO BANESTES VISA INTERNAC - ADICIONAL MULTIPLO
PROD_9,0001/0009,CARTAO BANESTES VISA INTERNAC - ADICIONAL
PROD_10,0001/0011,CARTAO BANESTES VISA GOLD PARC FINANC PELO LOJISTA
PROD_11,0001/0010,CARTAO BANESTES VISA GOLD PARC FINANCIADO PELO BANESTES
PROD_12,0001/0013,CARTAO BANESTES VISA INTERNAC FINANC PELO BANESTES
PROD_13,0001/0012,CARTAO BANESTES VISA INTERNAC FINANC PELO LOJISTA
PROD_14,0001/0014,CARTAO VISA GOLD PARC DE FATURA
PROD_15,0001/0015,CARTAO VISA INTER PARC DE FATURAS
PROD_16,0001/0016,CARTAO VISA GOLD - ROTATIVO NAO MIGRADO
PROD_17,0001/0017,CARTAO VISA INTERNAC- ROTATIVO NAO MIGRADO
PROD_18,0001/0018,CARTAO BANESTES VISA PLATINUM
PROD_19,0001/0019,CARTAO BANESTES VISA PLATINUM PARC FINANC PELO BANCO
PROD_20,0001/0020,CARTAO BANESTES VISA PLATINUM PARC FINANC PELO LOJISTA
PROD_21,0001/0021,CARTAO VISA PLATINUM PARC DE FATURAS
PROD_22,0001/0022,CARTAO VISA PLATINUM - ROTATIVO NAO MIGRADO
PROD_23,0001/0023,VISA GOLD SAQUE
PROD_24,0001/0024,VISA INTER SAQ
PROD_25,0001/0025,VISA PLAT SAQUE
PROD_26,0002/0001,CARTAO BANESCARD CREDITO
PROD_27,0002/0002,CARTAO BANESCARD CREDITO - ADICIONAL MULTIPLO
PROD_28,0002/0003,CARTAO BANESCARD CREDITO - ADICIONAL
PROD_29,0002/0005,CARTAO BANESCARD PARC FINANCIADO PELO LOJISTA
PROD_30,0002/0004,CARTAO BANESCARD PARC FINANCIADO PELO BANESTES
PROD_31,0002/0006,CARTAO BANESCARD PARC DE FATURAS
PROD_32,0002/0007,CARTAO BANESCARD - ROTATIVO NAO MIGRADO
PROD_33,0003/0001,TERMO DE ADESAO AO CARTAO PJ BANESTES
PROD_34,0003/0002,ADMINISTRADOR DE CARTAO PJ
PROD_35,0003/0003,ADMINISTRADOR EXECUTIVO - CARTAO PJ
PROD_36,0003/0004,PORTADOR DE CARTAO PJ
PROD_37,0003/0005,CONCESSAO DE USO DE EQUIP P.O.S NURIT 8320 E VX 510
PROD_38,0003/0006,CONCESSAO DE USO DE EQUIP P.O.S GPRS NURIT 8020
PROD_39,0003/0007,CONCESSAO DE USO DE EQUIP P.O.S GPRS NURIT 8400
PROD_40,0004/0003,BANESCARD VISA PARC FINANC PELO LOJISTA
PROD_41,0004/0001,BANESCARD VISA CREDITO
PROD_42,0004/0004,BANESCARD VISA PARC DE FATURAS
PROD_43,0004/0005,BANESCARD VISA ROTATIVO NAO MIGRADO
PROD_44,0004/0002,BANESCARD VISA PARC FINANC PELO BANCO
PROD_45,0004/0006,BANESCARD VISA SAQUE
PROD_46,0005/0001,AFILIACAO VISANET
PROD_47,0010/0001,BANESTIK CARTAO E VALE REFEICAO - EMPRESA CLIENTE
PROD_48,0010/0002,CARTAO BANESTIK ALIMENTACAO - EMPRESA CLIENTE
PROD_49,0010/0003,BANESTIK CARTAO ALIMENTACAO - CONVENIADO
PROD_50,0010/0004,BANESTIK CARTAO E VALE REFEICAO - CONVENIADO
PROD_51,0010/0005,BANESTIK REFEICAO - NAO CORRENTISTA - EMPRESA CLIENTE
PROD_52,0010/0006,CARTAO BANESTIK ALIMENTACAO -N CORRENTISTA-EMPR CLIENTE
PROD_53,0020/0001,EXPORTACAO ACC-ADIANTAMENTO SOBRE CONTRATO CAMBIO
PROD_54,0020/0002,EXPORTACAO BNDES - EXIM PRE-EMBARQUE
PROD_55,0020/0003,EXPORTACAO BNDES - EXIM PRE-EMBARQUE ESPECIAL
PROD_56,0020/0004,EXPORTACAO BNDES - EXIM POS-EMBARQUE
PROD_57,0020/0005,EXPORTACAO ACE-ADIANTAM SOBRE CONTRATO CAMBIO - LE
PROD_58,0020/0006,EXPORTACAO PRONTA
PROD_59,0021/0001,EXPORT NOTE APLICACAO
PROD_60,0021/0002,EXPORT NOTE CAPTACAO
PROD_61,0023/0003,IMPORTACAO REFINANC
PROD_62,0023/0001,IMPORTACAO CARTA DE CREDITO
PROD_63,0023/0002,IMPORTACAO FINANCIADA
PROD_64,0023/0004,IMPORTACAO PRONTA
PROD_65,0024/0001,CAPTACAO DE MOEDA ESTRANGEIRA - PRE-EXPORT - BANQUEIROS
PROD_66,0024/0002,CAPTACAO DE MOEDA ESTRANGEIRA - RESOLUCAO 63
PROD_67,0024/0003,CAPTACAO DE MOEDA ESTRANGEIRA - RESOLUCAO 2148
PROD_68,0024/0004,CAPTACAO DE MOEDA ESTRANGEIRA - RESOLUCAO 2170
PROD_69,0024/0005,CAPTACAO DE MOEDA ESTRANGEIRA - PRE-EXPORT - C.C.2108
PROD_70,0024/0006,CAPTACAO EM MOEDA ESTRANGEIRA - IMPORTACAO
PROD_71,0025/0001,OPERACAO CURSADA AO AMPARO DO C.C.R
PROD_72,0030/0001,OPERACOES DE MESA CAMBIO-COMPRA INTERBANCARIA PRONTA
PROD_73,0030/0002,OPERACOES DE MESA CAMBIO-VENDA INTERBANC PRONTA
PROD_74,0030/0003,OPERACOES DE MESA CAMBIO-COMPRA INTERBANC FUTURA
PROD_75,0030/0004,OPERACOES DE MESA CAMBIO-VENDA INTERBANC FUTURA
PROD_76,0030/0005,OPERACOES DE MESA CAMBIO-COMPRA INTERBANC EXPORT NOTE
PROD_77,0030/0006,OPERACOES DE MESA CAMBIO-VENDA INTERBANC EXPORT NOTE
PROD_78,0033/0001,ALTERACAO CONTRATO COM PRORROGACAO DE PRAZO
PROD_79,0034/0001,ALTERACAO DE CONTRATO
PROD_80,0035/0001,AVISO RECEBIMENTO CARTA DE CREDITO
PROD_81,0036/0001,AVISO REC EMENDA CARTA DE CREDITO
PROD_82,0037/0001,CONFERENCIA CHAVE TELEGRAFICA
PROD_83,0038/0001,CUSTO DE DHL
PROD_84,0039/0001,EDICAO DE CONTRATO DE CAMBIO
PROD_85,0040/0001,LIBERACAO RESTRICAO CARTA CREDITO
PROD_86,0041/0001,PGMTO ANTECIPADO
PROD_87,0042/0001,REMESSA DE DOCUMENTO EXTERIOR
PROD_88,0043/0001,MENSAGEM POR TELEX/SWIFT
PROD_89,0044/0001,EMISSAO DE CHEQUE
PROD_90,0045/0001,ORDEM DE PGTo DO EXTERIOR
PROD_91,0046/0001,ORDEM DE PGTo PARA O EXTERIOR
PROD_92,0047/0001,TRANSFERENCIA DE CREDITO P/ OUTRO BANCO
PROD_93,0048/0001,EMENDA DE CARTA DE CREDITO
PROD_94,0049/0001,EMISSAO DE CARTA DE CREDITO
PROD_95,0051/0001,COBRANCA A VISTA E A PRAZO
PROD_96,0053/0001,TRANSFERENCIA DE COBRANCA
PROD_97,0054/0005,M.C.T.F. VENDA DE ORDEM DE PGMTO
PROD_98,0054/0001,M.C.T.F.COMPRA DE ESPECIE
PROD_99,0054/0002,M.C.T.F. COMPRA DE TRAVELERS CHEQUE
PROD_100,0054/0003,M.C.T.F.COMPRA DE ORDEM DE PGMTO
PROD_101,0054/0004,M.C.T.F.VENDA DE TRAVELERS CHEQUE
PROD_102,0054/0006,M.C.T.F . VENDA DE ESPECIE
PROD_103,0054/0007,M.C.T.F COMPRA DE CHEQUE
PROD_104,0054/0008,M.C.T.F VENDA DE CHEQUE
PROD_105,0054/0010,M.C.T.F EURO TURISMO VENDA DE ESPECIE - EUR
PROD_106,0054/0009,M.C.T.F EURO TURISMO COMPRA DE ESPECIE - EUR
PROD_107,0054/0011,FINANCEIRO COMPRA
PROD_108,0054/0012,FINANCEIRO VENDA
PROD_109,0055/0001,DEPOSITOS NO EXTERIOR EM MOEDAS ESTRANGEIRAS
PROD_110,0056/0001,OPERACOES CAMBIO A VISTA E/OU S ADIANT MOEDA NAC-USD
PROD_111,0056/0002,OPERACOES CAMBIO A VISTA E/OU S ADIANT MOEDA NAC-EUR
PROD_112,0056/0003,OPERACOES CAMBIO A VISTA E/OU S AD MOEDA NAC-DEMAIS MOEDAS
PROD_113,0056/0004,ARBITRAGEM COMPRA
PROD_114,0056/0005,ARBITRAGEM VENDA
PROD_115,0065/0001,GARANTIA EM MOEDA ESTRANG - FIANCA EM MOEDA ESTRANG
PROD_116,0065/0005,GARANTIA EM MOEDA ESTRANG - STAND BY LETTER OF CREDIT
PROD_117,0065/0004,GARANTIA EM MOEDA ESTRANG - PERFORMANCE BOND
PROD_118,0065/0003,GARANTIA EM MOEDA ESTRANG - BID BOND
PROD_119,0065/0002,GARANTIA EM MOEDA ESTRANG - AVAL EM MOEDA ESTRANG
PROD_120,0065/0006,GAR. EM MOEDA EST STANDYBYLETTER OF C BANESCARD
PROD_121,0066/0001,GAR EM MOEDA NAC-CARTA FIANCA C/GAR.APLIC.FINANC.
PROD_122,0066/0004,GARANTIA EM MOEDA NAC - CARTA DE FIANCA
PROD_123,0066/0005,"GAR EM MOEDA NAC-LIC, LEIL, PREST SERV OU EXEC OBRAS"
PROD_124,0066/0008,GARANTIA EM MOEDA NAC-OUTROS AVAIS
PROD_125,0066/0006,GAR EM MOEDA NAC-FORNECIMENTO DE MERCADORIAS
PROD_126,0066/0009,GARANTIA EM MOEDA NAC-OUTRAS FIANCAS
PROD_127,0066/0010,GARANTIA EM MOEDA NAC-OUTRAS GARANTIAS
PROD_128,0066/0007,GAR EM MOEDA NAC-PROC JUD E ADM DE NATUREZA FISCAL
PROD_129,0068/0001,CONTA JOVEM BANESTES
PROD_130,0068/0002,CONTA UNIVERSITARIA BANESTES
PROD_131,0070/0001,DESCONTO DE DUPLICATAS
PROD_132,0071/0001,DESCONTO DE NOTA PROMISSORIA PF
PROD_133,0071/0002,DESCONTO DE NOTA PROMISSORIA PJ
PROD_134,0072/0001,EXCESSO DE LIMITE PF
PROD_135,0072/0002,EXCESSO DE LIMITE PJ
PROD_136,0073/0001,CHEQUE CONFIANCA BANESTES
PROD_137,0073/0002,CHEQUE CONFIANCA FIDELIDADE BANESTES
PROD_138,0073/0003,CONTA ESPECIAL BANESCARD
PROD_139,0074/0001,CHEQUE CONFIANCA EMPRESA
PROD_140,0075/0001,ADIANTAMENTO A DEPOSITANTES PF
PROD_141,0075/0002,ADIANTAMENTO A DEPOSITANTES PJ
PROD_142,0077/0001,REPASSE RESOLUCAO 63
PROD_143,0078/0003,CONTA GARANTIDA COM CAUCAO DE TITULOS
PROD_144,0078/0008,CONTA GARANTIDA COM GARANTIA CDB - PF
PROD_145,0078/0004,CONTA GARANTIDA COM HIPOTECA - PF
PROD_146,0078/0006,CONTA GAR C/ ALIENACAO FIDUCIARIA - PF
PROD_147,0078/0007,CONTA GAR C/ ALIENACAO FIDUCIARIA - PJ
PROD_148,0078/0005,CONTA GAR C/ GARANTIA HIPOTECA - PJ
PROD_149,0078/0001,CONTA GARANTIDA - PF
PROD_150,0078/0002,CONTA GARANTIDA - PJ - AVAL
PROD_151,0078/0009,CONTA GARANTIDA COM GARANTIA DE CDB- PJ
PROD_152,0078/0013,CONTA GAR C/ GARANTIA DE RECEBIVEIS DE TERCEIROS
PROD_153,0078/0011,CONTA GARANTIDA COM CAUCAO DE CHEQUES
PROD_154,0078/0010,CONTA GARANTIDA - ANTECIPACAO VISANET
PROD_155,0078/0012,CONTA GARANTIDA  - EMPRESTIMOS ICMS-FUNDAP
PROD_156,0078/0014,CONTA GAR - BANESCARD - TITULARES DE CARTAO DE CRED
PROD_157,0078/0015,CONTA GARANTIDA DE INVEST
PROD_158,0078/0016,CONTA GAR C/ ALIENACAO FIDUCIARIA DE IMOVEIS PF
PROD_159,0078/0017,CONTA GAR C/ ALIENACAO FIDUCIARIA DE IMOVEIS PJ
PROD_160,0078/0018,CREDITO ROTATIVO PORTUARIO
PROD_161,0078/0019,CONTA GARANTIDA COM GARANTIA DE WARRANT - PJ
PROD_162,0078/0020,CONTA GARANTIDA COM AMORTIZACAO AUTOMATICA
PROD_163,0078/0021,CONTA GARANTIDA REVENDEDORA DE VEICULOS
PROD_164,0078/0022,CONTA GARANTIDA IMOBILIARIA
PROD_165,0078/0023,CONTA GARANTIDA - RECEBIVEIS BANESCARD
PROD_166,0078/0030,CONTA GARANTIDA RECEBIVEIS
PROD_167,0078/0025,CONTA GARANTIDA PRONAF
PROD_168,0078/0026,CONTA GARANTIDA TICKET
PROD_169,0078/0027,CONTA GAR ALIENA. IMOVEIS PJ. GARANTIA IMOVEL PROPRIO
PROD_170,0079/0001,CREDITO ROTATIVO PMES
PROD_171,0080/0001,ARO - ANTECIPACAO DE RECEITA ORCAMENTARIA
PROD_172,0081/0003,CHEQUE MONEY CAUCAO DE CHEQUES - PJ
PROD_173,0081/0004,CHEQUE MONEY - DESCONTO DE CHEQUES PF
PROD_174,0081/0005,CHEQUE MONEY- DESCONTO DE CHEQUE PJ
PROD_175,0083/0001,DESCONTO DE TITULOS (LIMITE ANTEC. RECEBIVEIS)
PROD_176,0083/0002,DESCONTO DE DUPLICATA
PROD_177,0083/0003,DESCONTO DE CHEQUES
PROD_178,0083/0004,DESCONTO DE CHEQUE ELETRONICO
PROD_179,0083/0005,DESCONTO DE NOTA PROMISSORIA - NP
PROD_180,0083/0007,ANTECIPACAO RECEBIVEIS VISA
PROD_181,0083/0008,ANTECIPACAO RECEBIVEIS CIELO
PROD_182,0083/0009,ANTECIPACAO RECEBIVEIS BANESCARD
PROD_183,0083/0013,DESCONTO DE CHEQUE PF
PROD_184,0083/0010,ANTECIPACAO DE RECEBIVEIS BANESTIK
PROD_185,0083/0012,ANTECIPACAO RECEBIVEIS MASTERCARD
PROD_186,0086/0001,VENDOR BANESTES
PROD_187,0087/0001,ANTECIPACAO DE RECEBIVEIS BANESCARD
PROD_188,0090/0001,CREDIFACIL SALARIO
PROD_189,0090/0002,CREDIFACIL SERV PUBL EST/MUN-EFETIVOS
PROD_190,0090/0003,CREDIFACIL EMPREGADOS E APOSENTADOS DO SFB
PROD_191,0090/0004,CREDITO ROTATIVO PARCELADO
PROD_192,0090/0005,CREDITO RAPIDO BANESTES
PROD_193,0090/0006,CREDIFACIL SERV PUBL ESTADUAL/MUNICIPAL -  DT
PROD_194,0090/0007,ANTECIPACAO SALARIAL - REPOSICAO
PROD_195,0090/0008,CREDITO PESSOAL P/ EMPREG DO SFB PROG SOCIO ECON
PROD_196,0090/0009,CREDIFACIL INSTITUTO DE PREVIDENCIA
PROD_197,0090/0010,CREDIFACIL SERV IPAMV
PROD_198,0090/0012,CREDIFACIL SERV PUBL EST/MUN-EFETIVOS-CCE
PROD_199,0090/0011,CREDIFACIL SALARIO - CCE
PROD_200,0090/0013,CREDIFACIL EMPREGADOS E APOSENTADOS DO SFB - CCE
PROD_201,0090/0014,ANTECIPACAO PRECATORIOS
PROD_202,0090/0015,CREDIFACIL PORTABILIDADE - SERV
PROD_203,0090/0016,CREDIFACIL PARCELAMENTO DE CARTAO DE CREDITO
PROD_204,0090/0017,CREDIFACIL PORTABILIDADE - CLIENTES EM GERAL
PROD_205,0090/0018,CREDITO SERV DT - CCE
PROD_206,0090/0019,CREDITO ESTAGIARIO NIVEL SUPERIOR SFB
PROD_207,0090/0020,CREDITO ESTAGIARIO NIVEL SUPERIOR SFB - CCE
PROD_208,0090/0021,CREDIFACIL TITULAR DE CARTORIO
PROD_209,0090/0022,ANTECIP SALARIAL - PREFEITURA MUN DE IBITIRAMA
PROD_210,0090/0023,CREDIFACIL PARCELAMENTO DE CHECON
PROD_211,0090/0024,ANTECIP SALARIAL-PREF MUN DE DIVINO SAO LOURENCO
PROD_212,0091/0001,FINANC DE BENS - PF
PROD_213,0091/0002,FINANC DE ECF - EQUIP EMISSOR DE CUPOM FISCAL
PROD_214,0091/0003,FINANC DE BENS - PJ
PROD_215,0091/0005,FINANC DO IPVA - PF
PROD_216,0091/0006,FINANC DO IPVA - PJ
PROD_217,0091/0004,FINANC DE BENS PARA EMPREGADOS DO SFB
PROD_218,0091/0007,FINANC DE VEICULOS PF
PROD_219,0091/0008,FINANC DE MOTOS PF
PROD_220,0091/0009,FINANC DE BENS IMOVEIS RETOMADOS PJ
PROD_221,0091/0010,CREDIFACIL MATERIAL DE CONSTRUCAO BANESTES
PROD_222,0091/0011,FINANC DE VEICULOS PJ
PROD_223,0091/0012,FINANC DE ELETRODOMESTICOS
PROD_224,0091/0017,FINANC DE VEICULOS NOVOS - PF
PROD_225,0091/0021,FINANC DE VEICULOS NOVOS - PJ
PROD_226,0091/0013,CREDIFACIL CIPASA
PROD_227,0091/0014,FINANC DE TRIBUTOS - MICROEMPREENDEDOR
PROD_228,0091/0022,CREDIFACIL POS GRADUACAO/MBA
PROD_229,0091/0023,CREDIFACIL POS GRADUACAO FUNCIONARIOS SFB
PROD_230,0091/0024,FINANC DE BENS EMERGENCIAL
PROD_231,0091/0027,FINANC DE VEICULOS - SERV
PROD_232,0091/0016,FINANC ENERGIA LIMPA PJ
PROD_233,0091/0015,CREDITO ENERGIA LIMPA/PF
PROD_234,0091/0018,FINANC DE BENS IMPORTADOS RURAIS
PROD_235,0091/0019,FINANC DE MOTOS PREMIUM
PROD_236,0091/0020,FINANC DE BENS IMOVEIS RETOMADOS PF
PROD_237,0091/0028,FINANC DE VEICULOS HIBRIDOS E ELETRICOS PF
PROD_238,0091/0029,FINANC DE VEICULOS HIBRIDOS E ELETRICOS PJ
PROD_239,0091/0025,FINANC CRESCER CIDADES GARANTIA UNIAO
PROD_240,0091/0026,FINANC CRESCERCIDADES GARANTIA QPM ICMS
PROD_241,0092/0001,CONSIG EM FOLHA PGMTO
PROD_242,0092/0003,CONSIG EM FOLHA PGMTO - EMPRESA PRIVADA
PROD_243,0092/0002,CONSIG EM FOLHA PGMTO - SERV PUBL
PROD_244,0092/0004,CONSIG EM FOLHA PGMTO-SERV PUB SIND C/ VERBA
PROD_245,0092/0006,CONSIGN EM FOLHA PGMTO-SERV PUBL SIN S VERBA
PROD_246,0092/0005,EMPREGADO DE EMPRESA PRIVADA
PROD_247,0092/0007,CONSIG EM FOLHA PGMTO-EMPRESA PRIVADA SIND S/ VERB
PROD_248,0092/0008,CONSIG EM FOLHA PGMTO-SERV PUBL N SINDICAL
PROD_249,0092/0009,CONSIG EM FOLHA PGMTO-EMPRESA PRIVADA N SINDICALI
PROD_250,0092/0010,CONSIG FOLHA PGMTO-SERV PUBL MUNICIPAL DT
PROD_251,0092/0012,CONSIG EM FOLHA PGMTO - SERV PUBL EFETIVO
PROD_252,0092/0013,CONSIG EM FOLHA PGMTO -BENEFICIARIOS INSS
PROD_253,0092/0102,CONSIG EM FOLHA PGMTO - SERV PUBL - CCB
PROD_254,0092/0110,CONSIG EM FOLHA PGMTO - SERV PUBL DT/COMIS - CCB
PROD_255,0092/0112,CONSIG EM FOLHA PGMTO - SERV PUBL EFETIVO CCB
PROD_256,0092/0014,CONSIG EM FOLHA PGMTO SERV.PUB.EST-ALONGAMENTO
PROD_257,0092/0015,CONSIG EMP PRIV COM GARANTIA DE AVAL
PROD_258,0092/0103,CONSIG EM FOLHA PGMTO - EMPRESA PRIVADA - CBF
PROD_259,0092/0105,CONSIG EM FOLHA PGMTO-EMPR PRIV SIND COM VERB - CBF
PROD_260,0092/0016,CONSIG EM FOLHA PGMTO - SERV PUBL FEDERAL
PROD_261,0092/0018,CONSIG EM FOLHA PGMTO SERV PUBL COMISSIONADO
PROD_262,0092/0118,CONSIG EM FOLHA PGMTO - SERV PUBL COMISSIONADO
PROD_263,0092/0116,CONSIG SERV PUBL FEDERAL-CORRESPONDENTE
PROD_264,0092/0022,CONSIG EM FOLHA PGMTO- SERV PUB EST EFET OU APO 57M
PROD_265,0092/0028,CONSIG EM FOLHA PGMTO-SERV PUB EST COMISS 57 MESES
PROD_266,0092/0122,CONSIG EM FOLHA PGMTO- SERV PUB EST EFET OU APOS 57-COR
PROD_267,0092/0128,CONSIG EM FOLHA PAGAM- SERV PUB EST COMIS 57 MESES COR
PROD_268,0092/0020,CONSIG EM FOLHA PGMTO-SERV PUBL-EMERGENCIAL
PROD_269,0092/0011,CONSIG EM FOLHA PGMTO SERV PUBL CCE
PROD_270,0093/0001,PARCERIA EMPRESARIAL
PROD_271,0093/0002,CRED BANESTIK PJ
PROD_272,0094/0001,CAPITAL DE GIRO
PROD_273,0094/0002,CAPITAL DE GIRO MANUAL
PROD_274,0094/0003,CAPITAL DE GIRO COM RECEBIVEIS DE TERCEIROS
PROD_275,0094/0004,GIRO EMPRESARIAL
PROD_276,0094/0005,CAPITAL DE GIRO EMERGENCIAL
PROD_277,0094/0006,INVESTGIRO BANESTES/FAMPES
PROD_278,0094/0007,INVEST BANESTES/FAMPES
PROD_279,0094/0011,GIRO AUTOMATICO - CCE
PROD_280,0094/0008,CAPITAL DE GIRO - AVAL
PROD_281,0094/0009,CAPITAL DE GIRO - CORRESPONDENTE
PROD_282,0094/0010,CAPITAL DE GIRO PARCELA DE ENCARGOS NA CARENCIA
PROD_283,0094/0012,CAPITAL DE GIRO - BANESCARD
PROD_284,0094/0013,CAPITAL DE GIRO - VISA
PROD_285,0094/0014,CAPITAL DE GIRO EMPREENDEDOR
PROD_286,0094/0015,CAPITAL DE GIRO EMPREENDEDOR - CLEAN
PROD_287,0094/0018,CAPITAL DE GIRO AVAL
PROD_288,0094/0021,CAPITAL DE GIRO
PROD_289,0094/0016,CRED INVEST
PROD_290,0094/0017,CRED GIRO
PROD_291,0094/0022,CAPITAL DE GIRO C/ PGMTO DE ENCARGOS NA CARENCIA
PROD_292,0094/0026,CRED INVEST C/ ENCARGOS NA CARENCIA
PROD_293,0094/0027,CRED GIRO COM ENCARGOS NA CARENCIA
PROD_294,0094/0028,CAPITAL DE GIRO COM GARANTIA DE RECEBIVEIS SUS
PROD_295,0094/0029,CRED INV ENCARGOS CAR SEBRAE GAR IMOVEL PROPRIO
PROD_296,0094/0030,CAPITAL DE GIRO EMERGENCIAL PME
PROD_297,0094/0031,CAPITAL DE GIRO EMERG - PAND CORONAVIRUS
PROD_298,0094/0032,CAPITAL DE GIRO EMERG - FOLHA DE PGMTO COVID19
PROD_299,0094/0033,CAPITAL DE GIRO-FGO PRONAMPE
PROD_300,0094/0034,CAPITAL DE GIRO-ANTECIPACAO PIX
PROD_301,0094/0035,CAPITAL DE GIRO PARCELAMENTO DE CEB
PROD_302,0094/0036,GIRO PRONAMPE PROFISSIONAL LIBERAL
PROD_303,0094/0037,CAPITAL DE GIRO FGO PRONAMPE
PROD_304,0094/0038,CAPITAL DE GIRO MADE IN ES
PROD_305,0094/0039,CAPITAL DE GIRO ACELERA
PROD_306,0094/0040,CAPITAL DE GIRO EXCLUSIVE
PROD_307,0095/0001,FINANC DE TELEFONES
PROD_308,0095/0002,REFINANC DE TELEFONE
PROD_309,0095/0004,FINANC - REDE BANESCARD PF
PROD_310,0095/0003,FINANC REDE BANESCARD
PROD_311,0096/0001,FINANC DE BENS E SERVICOS - BANESTES FINANC
PROD_312,0096/0002,CDC LOJA - CREDCOMPRAS
PROD_313,0096/0003,BANESTES CDC TURISMO
PROD_314,0096/0006,BANESTES CDC ODONTO
PROD_315,0096/0004,FINANC DE BENS E SERVICOS -PF- BANESTES FINANC
PROD_316,0096/0005,FINANC DE BENS E SERVICOS- PJ - BANESTES FINANC
PROD_317,0096/0007,FINANC DE BENS E SERVICOS-PF-BANESTES FINANC
PROD_318,0097/0001,EMPRESTIMO PESSOAL - BANESTES FINANCEIRA
PROD_319,0097/0002,EMPRESTIMO PESSOAL IPVA - BANESTES FINANCEIRA
PROD_320,0097/0003,EMPRESTIMO PESSOAL- CDC TURISMO
PROD_321,0097/0004,EMPRESTIMO PESSOAL - BANESTES FINANCEIRA
PROD_322,0097/0005,BANESTES CDC TURISMO
PROD_323,0098/0001,CREDIPVA
PROD_324,0098/0002,CRED BANESTIK PF
PROD_325,0099/0001,CREDIFACIL- PUBL GERAL
PROD_326,0099/0002,CREDIFACIL BENEFICIO
PROD_327,0099/0003,ANTECIPACAO DE 13  SALARIO
PROD_328,0099/0012,CREDIFACIL BENEFICIO - CCE
PROD_329,0099/0011,CREDIFACIL CCE
PROD_330,0099/0004,CREDIFACIL EMPREGADOS E APOSENTADOS SFB - ACOES
PROD_331,0099/0005,CREDIFACIL PORTUARIO
PROD_332,0099/0006,CREDIFACIL - AGENTES DE SEGURANCA
PROD_333,0099/0007,CREDIFACIL EMERGENCIAL
PROD_334,0099/0008,CREDIFACIL IMOVEL (HOME EQUITY)
PROD_335,0099/0009,CREDIFACIL AUTOMOVEL
PROD_336,0099/0013,ANTECIPACAO SALARIAL
PROD_337,0099/0360,ANTECIPACAO DE 13 SALARIO - SERV
PROD_338,0099/0014,CREDIFACIL PLUS
PROD_339,0100/0001,RESTITUICAO DO IMPOSTO DE RENDA
PROD_340,0101/0008,RESSARCIMENTO POR RESPONSABILIDADE CIVIL
PROD_341,0101/0009,RESSARCIMENTO POR RESPONS CIVIL- ACORDO NOS AUTOS
PROD_342,0102/0001,CONVENIO SINDIFISCAL
PROD_343,0102/0002,CONVENIO SINDIPOL
PROD_344,0102/0003,CONVENIO SINDELPO
PROD_345,0102/0004,CONVENIO SINDICATO DOS SERV PUB DO EST DO ES
PROD_346,0104/0001,CARTAO CREDCOMPRAS ELETRONICO
PROD_347,0104/0002,CARTAO EXTRABOM BANESTES
PROD_348,0105/0001,COMPROR BANESTES - AVAL
PROD_349,0105/0002,COMPROR BANESTES - GARANTIA REAL
PROD_350,0106/0001,CESSAO DE CRED ADQUIRIDO COM OBRIGACAO DO CEDENTE
PROD_351,0106/0002,CESSAO DE CRED COM OBRIGACAO - RESOLUCAO 3533
PROD_352,0107/0010,CREDITO INVEST COM PGMTO DE ENCARGOS NA CARENCIA
PROD_353,0107/0001,CREDITO INVEST
PROD_354,0107/0011,CRED INV ENCARGOS NA CARENCIA. GAR IMOVEL PROPRIO
PROD_355,0107/0003,CREDITO INVEST PARCERIA BANESTES E BANDES LIDER
PROD_356,0107/0002,CREDITO INVEST PARCERIA BANESTES LIDER E BANDES
PROD_357,0107/0004,CREDITO INVEST PARCELAMENTO CARTAO BNDES
PROD_358,0107/0012,CREDITO INVEST ACELERA
PROD_359,0107/0013,CREDITO INVEST EXCLUSIVE
PROD_360,0108/0001,FINANC A EXPORTACAO
PROD_361,0108/0010,FINANC A EXPORTACAO COM ENCARGOS NA CARENCIA
PROD_362,0108/0002,NOTA DE CREDITO A EXPORTACAO INDIRETA
PROD_363,0110/0001,ARRENDAMENTO MERCANTIL PJ BENS VIDA UTIL ATE 5 ANOS
PROD_364,0110/0002,ARRENDAMENTO MERCANTIL PJ BENS VIDA UTIL ACIMA 5 ANOS
PROD_365,0110/0003,ARRENDAMENTO MERCANTIL - VEICULOS PJ
PROD_366,0110/0004,LEASING BANES AUTO PF
PROD_367,0110/0005,ARRENDAMENTO MERCANTIL-FUNCIONARIO-AUTOMOVEIS
PROD_368,0110/0006,ARRENDAMENTO MERCANTIL/POS/MICROCOMP/IMPRESSORA
PROD_369,0110/0007,TITULOS PUBLS FEDERAIS - LFT - APLICACAO OVER
PROD_370,0110/0008,DEPOSITO INTERFINANCEIRO - PRE-FIXADO - CAPTACAO
PROD_371,0110/0009,LEAS CONSIG EM FOLHA - VEICULOS -  EMPRESA PRIV
PROD_372,0110/0010,LEAS CONSIG FOLHA MAQ EQUIP VIDA UTIL ATE 5A EMP PRIV
PROD_373,0110/0012,LEAS CONSIG EM FOLHA - VEICULOS - EMP PUBL
PROD_374,0110/0013,LEAS CONSIG FOLHA MAQ EQUIP VIDA UTIL ATE 5A EMP PUBL
PROD_375,0110/0015,ARRENDAMENTO MERCANTIL VEICULOS - PF
PROD_376,0110/0016,ARREND MERC - BENS COM VIDA UTIL ATE 05 ANOS - PF
PROD_377,0110/0017,ARREND MERC PF - BENS COM VIDA UTIL ACIMA 05 ANOS
PROD_378,0110/0018,LEASING AUTOMOVEIS GEREL
PROD_379,0120/0001,CUSTEIO AGRICOLA
PROD_380,0120/0002,PROGER PRONAMP - CUSTEIO AGRICOLA
PROD_381,0120/0003,CUSTEIO AGRICOLA - R. LIVRE
PROD_382,0120/0004,CUSTEIO AGRICOLA - LASTREADO POR DIR
PROD_383,0121/0001,CUSTEIO PECUARIO
PROD_384,0121/0002,PROGER PRONAMP - CUSTEIO PECUARIO
PROD_385,0121/0003,CUSTEIO PECUARIO - R. LIVRE
PROD_386,0121/0004,CUSTEIO PECUARIO - LASTREADO POR DIR
PROD_387,0122/0001,INVEST AGRICOLA
PROD_388,0122/0002,PRONAMP - INVEST AGRICOLA
PROD_389,0123/0001,INVEST PECUARIO
PROD_390,0123/0002,PRONAMP - INVEST PECUARIO
PROD_391,0124/0001,PROG NAC APROV VARZEAS IRRIGAVEIS/APLICACAO
PROD_392,0124/0002,PROGR NAC DE APROV DE VARZEAS IRRIGAVEIS/REPASSE
PROD_393,0125/0001,PROG DE CREDITO RURAL DIFERENCIADO/APLICACAO
PROD_394,0125/0002,PROG DE CREDITO RURAL DIFERENCIADO/REPASSE
PROD_395,0126/0002,PROG NAC DE FORTALEC AGRIC FAMILIAR- INVEST
PROD_396,0126/0001,PROG NAC DE FORTALEC AGRIC FAMILIAR - CUSTEIO
PROD_397,0126/0004,PRONAF BNDES
PROD_398,0126/0005,PROG NAC DE FORT AGRIC FAMILIAR GRUPO E CUSTEIO
PROD_399,0126/0006,PROG NAC DE FORT DA AGRIC FAMILIAR GRUPO E INVEST
PROD_400,0126/0008,PROG NAC DE FORTALEC AGRIC FAMILIAR-CUSTEIO AGRIC
PROD_401,0126/0009,PROG NAC DE FORTALEC AGRIC FAMILIAR- CUSTEIO PEC
PROD_402,0131/0001,FISCALIZACAO E AVALIACAO
PROD_403,0132/0001,CONTA GRAFICA
PROD_404,0133/0001,ADITIVO CONTRATUAL RURAL
PROD_405,0134/0001,SUBSTITUICAO DE GARANTIA RURAL
PROD_406,0135/0001,LIBERACAO DE HIPOTECA RURAL
PROD_407,0136/0001,CANCELAMENTO CONTRATO JA DEFERIDO
PROD_408,0137/0002,RENEGOCIACAO RURAL - SECURITIZACAO
PROD_409,0137/0003,SECURITIZACAO 2471
PROD_410,0138/0001,FUNCAFE - COLHEITAS DE CAFE
PROD_411,0138/0002,FUNCAFE - REPASSE         E
PROD_412,0138/0003,FUNCAFE - ESTOCAGEM DE CAFE
PROD_413,0138/0004,FUNCAFE - CUSTEIO
PROD_414,0138/0005,FUNCAFE - TORREFACAO - CAPITAL DE GIRO P/ INDUSTRIAS
PROD_415,0138/0006,FUNCAFE - CAFE SOLUVEL - CAPITAL DE GIRO P/ INDUSTRIAS
PROD_416,0138/0008,FUNCAFE - RECUPERACAO DE CAFEZAIS DANIFICADOS
PROD_417,0138/0007,FUNCAFE - FAC - FINANC PARA AQUISICAO DE CAFE
PROD_418,0138/0009,FUNCAFE COMERCIALIZACAO
PROD_419,0140/0001,CUSTEIO LCA -  TAXAS CONTROLADAS
PROD_420,0142/0001,INVEST LCA
PROD_421,0142/0002,INVEST LCA - PARCERIAS EMPRESAS
PROD_422,0143/0001,LCA COMERCIALIZACAO
PROD_423,0150/0001,FINAME AUTOMATICO
PROD_424,0150/0003,FINAME AGRICOLA
PROD_425,0150/0002,FINAME ESPECIAL
PROD_426,0150/0004,FINAME
PROD_427,0150/0005,FINAME-REPASSE
PROD_428,0150/0006,FINAME IMPORTACAO
PROD_429,0150/0007,BNDES PROGEREN/GIRO
PROD_430,0150/0008,BNDES PROGEREN
PROD_431,0150/0009,FINAME MODERMAQ
PROD_432,0150/0010,FINAME MODERMAQ
PROD_433,0150/0011,BNDES PROCOMP
PROD_434,0150/0012,BNDES PROCOMP
PROD_435,0150/0013,FINAME PROCAMINHONEIRO
PROD_436,0150/0014,FINAME PROCAMINHONEIRO - REPASSE
PROD_437,0150/0015,FINAME PROESCOLAR
PROD_438,0150/0016,FINAME PROESCOLAR
PROD_439,0150/0017,PROG BNDES DE SUSTENTACAO DO INVESTIMETO
PROD_440,0150/0018,PROG BNDES DE SUSTENTACAO DO INVEST
PROD_441,0150/0019,PROG BNDES DE SUSTENTACAO DO INVEST
PROD_442,0150/0020,PROG BNDES DE SUSTENTACAO DO INVEST
PROD_443,0150/0021,PROG BNDES DE SUSTENTACAO DO INVEST - BNDES PSI
PROD_444,0150/0022,PROG BNDES DE SUSTENTACAO DO INVEST - BNDES PSI
PROD_445,0150/0023,FINAME-TLP
PROD_446,0150/0024,FINAME-TLP-REPASSE
PROD_447,0150/0025,BNDES GIRO-TLP PEQUENAS EMPRESAS
PROD_448,0150/0026,BNDES GIRO-TLP-REPASSE
PROD_449,0150/0027,BNDES-FUNDO CLIMA
PROD_450,0150/0028,BNDES-FUNDO CLIMA - REPASSE
PROD_451,0150/0029,BNDES - FINAME TFB
PROD_452,0150/0030,BNDES FINAME TFB
PROD_453,0150/0031,BNDES GIRO - TFB
PROD_454,0150/0032,BNDES GIRO TFB PASSIVO
PROD_455,0151/0001,RENEGOCIACAO -FINAME
PROD_456,0151/0002,RENEGOCIACAO -FUNRES
PROD_457,0153/0001,FUNRES INVEST FIXO MISTO
PROD_458,0153/0002,FUNRES INVEST SEMI-FIXO
PROD_459,0153/0004,FUNRES - REPASSE
PROD_460,0153/0003,FUNRES - REPASSE
PROD_461,0154/0001,FUNGETUR - REPASSE
PROD_462,0154/0002,FUNGETUR -FUNDO GERAL DE TURISMO
PROD_463,0155/0001,EXTRATOS FINANC
PROD_464,0156/0001,CANCELAMENTO PROPOSTA FINAME
PROD_465,0157/0001,ADITIVO CONTRATUAL INDUSTRIAL
PROD_466,0158/0001,SUBSTITUICAO DE GARANTIA INDUSTRIAL
PROD_467,0159/0001,LIBERACAO DE ALIENACAO FIDUCIARIA - INDUSTRIAL
PROD_468,0160/0001,LIBERACAO DE HIPOTECA - INDUSTRIAL
PROD_469,0162/0001,PREFEITURAS
PROD_470,0163/0001,BNDES AUTOMATICO/PRORENOVA
PROD_471,0163/0002,BNDES AUTOMATICO
PROD_472,0163/0003,BNDES REVITALIZA
PROD_473,0163/0004,BNDES REVITALIZA
PROD_474,0163/0005,BNDES REVITALIZA TAXA FIXA - INVEST
PROD_475,0163/0006,BNDES REVITALIZA TAXA FIXA - INVEST REPASSE
PROD_476,0163/0007,BNDES REVITALIZA TAXA FIXA - GIRO
PROD_477,0163/0008,BNDES REVITALIZA TAXA FIXA - GIRO - REPASSE
PROD_478,0163/0010,PROG ESPECIAL DE CREDITO/ PROGEREN
PROD_479,0163/0009,PROG ESPECIAL DE CREDITO/PROGEREN
PROD_480,0163/0012,PRO.BNDES EMERG.RECONST MUN AFET POR D NATURAIS
PROD_481,0163/0011,PRO.BNDES EMERG.RECONST MUN AFET POR D NATURAIS
PROD_482,0163/0013,PRO.BNDES EMERG.RECONST MUN AFET POR D NATURAIS
PROD_483,0163/0014,PRO.BNDES EMERG.RECONST MUN AFET POR D NATURAIS
PROD_484,0163/0015,BNDES AUTOMATICO-TLP
